Sheet: Circumcircle
A1: Circumcircle / Circumcenter
A2: The circumcenter is the intersection of the perpendicular bisectors of the sides
A3: It is the intersection of the perpendicular bisectors of the sides
A4: This can be used to fit a circle to any three points
A5: Fred Seelig
A6: 2007-05-24
A7: Updated Nov. 7, 2011
A8: Consistent with equations found in "circumcenter," Everything2 writeup
A11: Triangle - Vertices | E11: x | F11: y | G11: x^2+y^2 | J11: Triangle
B12: Vertex | D12: A | E12: -3 | F12: -2 | G12: of:=[.E12]^2+[.F12]^2 -> 13 | J12: of:=[.E12] -> -3 | K12: of:=[.F12] -> -2
B13: Vertex | D13: B | E13: 6 | F13: 0 | G13: of:=[.E13]^2+[.F13]^2 -> 36 | J13: of:=[.E13] -> 6 | K13: of:=[.F13] -> 0
B14: Vertex | D14: C | E14: 2 | F14: 7 | G14: of:=[.E14]^2+[.F14]^2 -> 53 | J14: of:=[.E14] -> 2 | K14: of:=[.F14] -> 7
B15: Vertex | C15: (hide) | D15: A | E15: of:=[.E12] -> -3 | F15: of:=[.F12] -> -2 | G15: of:=[.G12] -> 13 | J15: of:=[.E12] -> -3 | K15: of:=[.F12] -> -2
B16: Vertex | C16: (hide) | D16: B | E16: of:=[.E13] -> 6 | F16: of:=[.F13] -> 0 | G16: of:=[.G13] -> 36
B17: Vertex | C17: (hide) | D17: C | E17: of:=[.E14] -> 2 | F17: of:=[.F14] -> 7 | G17: of:=[.G14] -> 53 | J17: Circumcenter
A18: Side Lengths, Semiperimeter, Area | E18: d | F18: d2 | J18: of:=[.E26] -> 0.894366197183099 | K18: of:=[.F26] -> 1.72535211267606
B19: length of side BC | D19: a | E19: of:=SQRT((([.E14]-[.E13])^2)+(([.F14]-[.F13])^2)) -> 8.06225774829855 | F19: of:=(([.E14]-[.E13])^2)+(([.F14]-[.F13])^2) -> 65
B20: length of side AC | D20: b | E20: of:=SQRT(([.E12]-[.E14])^2+([.F12]-[.F14])^2) -> 10.295630140987 | F20: of:=([.E12]-[.E14])^2+([.F12]-[.F14])^2 -> 106 | J20: Radial Lines
B21: length of side AB | D21: c | E21: of:=SQRT(([.E13]-[.E12])^2+([.F13]-[.F12])^2) -> 9.21954445729289 | F21: of:=([.E13]-[.E12])^2+([.F13]-[.F12])^2 -> 85 | J21: of:=[.J18] -> 0.894366197183099 | K21: of:=[.K18] -> 1.72535211267606
B22: semiperimeter | D22: s | E22: of:=([.E19]+[.E20]+[.E21])/2 -> 13.7887161732892 | J22: of:=[.J12] -> -3 | K22: of:=[.K12] -> -2
B23: Area of triangle | D23: K | E23: of:=SQRT([.E22]*([.E22]-[.E19])*([.E22]-[.E20])*([.E22]-[.E21])) -> 35.5
A24: Circumcircle | J24: of:=[.J18] -> 0.894366197183099 | K24: of:=[.K18] -> 1.72535211267606
C25: 2*(Ax*(Cy-By)+Bx*(Ay-Cy)+ Cx*(By-Ay)) | D25: D | E25: of:=2*([.E12]*([.F14]-[.F13])+[.E13]*([.F12]-[.F14])+[.E14]*([.F13]-[.F12])) -> -142 | J25: of:=[.J13] -> 6 | K25: of:=[.K13] -> 0
B26: Circumcenter | C26: Ox = (dA*(Cy-By) + dB*(Ay-Cy) + dC*(By-Ay))/D | D26: O | E26: of:=([.$G12]*([.F14]-[.F13])+[.$G13]*([.F12]-[.F14])+[.$G14]*([.F13]-[.F12]))/[.$E25] -> 0.894366197183099 | F26: of:=-([.$G12]*([.E14]-[.E13])+[.$G13]*([.E12]-[.E14])+[.$G14]*([.E13]-[.E12]))/[.$E25] -> 1.72535211267606
C27: Oy = -(dA*(Cx-Bx) + dB*(Ax-Cx) + dC*(Bx-Ax))/D | J27: of:=[.J18] -> 0.894366197183099 | K27: of:=[.K18] -> 1.72535211267606
B28: radius of circumcircle | C28: a*b*c /(4K) | D28: R | E28: of:=([.E19]*[.E20]*[.E21])/(4*[.E23]) -> 5.38927977017173 | H28: 3 | J28: of:=[.J14] -> 2 | K28: of:=[.K14] -> 7
B29: Area of circumcircle | C29: p*R2 | D29: A_circum | E29: of:=PI()*[.E28]^2 -> 91.2454739920086
A30: Interior Angles | E30: deg | F30: rad | J30: Perpendicular bisectors
C31: acos((b2+c2-a2)/(2bc)) | D31: a | E31: of:=DEGREES([.F31]) -> 48.4165881917713 | F31: of:=ACOS((([.E20]^2+[.E21]^2)-([.E19]^2))/(2*[.E20]*[.E21])) -> 0.845028876528617 | J31: of:=[.J18] -> 0.894366197183099 | K31: of:=[.K18] -> 1.72535211267606
C32: acos((c2+a2-b2)/(2bc)) | D32: b | E32: of:=DEGREES([.F32]) -> 72.7839264122093 | F32: of:=ACOS((([.E19]^2+[.E21]^2)-([.E20]^2))/(2*[.E19]*[.E21])) -> 1.27031915842232 | J32: of:=[.E41] -> 1.5 | K32: of:=[.F41] -> -1
C33: acos((a2+b2-c2)/(2bc)) | D33: g | E33: of:=DEGREES([.F33]) -> 58.7994853960194 | F33: of:=ACOS((([.E19]^2+[.E20]^2)-([.E21]^2))/(2*[.E19]*[.E20])) -> 1.02624461863886
E34: of:=SUM([.E31:.E33]) -> 180 | J34: of:=[.J18] -> 0.894366197183099 | K34: of:=[.K18] -> 1.72535211267606
A35: Radial Angles | J35: of:=[.E42] -> 4 | K35: of:=[.F42] -> 3.5
C36: 2a | D36: fA | E36: of:=2*[.E31] -> 96.8331763835427 | F36: of:=2*[.F31] -> 1.69005775305724
C37: 2b | D37: fB | E37: of:=2*[.E32] -> 145.567852824419 | F37: of:=2*[.F32] -> 2.54063831684463 | J37: of:=[.J18] -> 0.894366197183099 | K37: of:=[.K18] -> 1.72535211267606
C38: 2g | D38: fC | E38: of:=2*[.E33] -> 117.598970792039 | F38: of:=2*[.F33] -> 2.05248923727772 | J38: of:=[.E43] -> -0.5 | K38: of:=[.F43] -> 2.5
E39: of:=SUM([.E36:.E38]) -> 360 | F39: of:=SUM([.F36:.F38]) -> 6.28318530717959
A40: Projection of O onto Sides
B41: Footers of altitudes from O' onto sides | E41: of:=[.E47] -> 1.5 | F41: of:=[.F47] -> -1
E42: of:=[.E52] -> 4 | F42: of:=[.F52] -> 3.5
E43: of:=[.E57] -> -0.5 | F43: of:=[.F57] -> 2.5
B44: Point on line P1 | D44: of:=[.D12] -> A | E44: of:=[.E12] -> -3 | F44: of:=[.F12] -> -2
B45: Point on line P2 | D45: of:=[.D13] -> B | E45: of:=[.E13] -> 6 | F45: of:=[.F13] -> 0
B46: Point not on line Q | D46: O | E46: of:=[.E26] -> 0.894366197183099 | F46: of:=[.F26] -> 1.72535211267606 | I46: 0 | J46: of:=[.$E$28]*COS(2*PI()*[.$I46]/36)+[.J$18] -> 6.28364596735483 | K46: of:=[.$E$28]*SIN(2*PI()*[.$I46]/36)+[.K$18] -> 1.72535211267606
B47: Footer on line F=P1+k0(P2-P1) | C47: (Algorithm found on "Altitudes" worksheet) | D47: F, Q0 | E47: of:=[.E44]+(((([.E46]-[.E44])*([.E45]-[.E44]))+(([.F46]-[.F44])*([.F45]-[.F44])))/(([.E45]-[.E44])^2+([.F45]-[.F44])^2))*([.E45]-[.E44]) -> 1.5 | F47: of:=[.F44]+(((([.E46]-[.E44])*([.E45]-[.E44]))+(([.F46]-[.F44])*([.F45]-[.F44])))/(([.E45]-[.E44])^2+([.F45]-[.F44])^2))*([.F45]-[.F44]) -> -1 | I47: of:=1+[.I46] -> 1 | J47: of:=[.$E$28]*COS(2*PI()*[.$I47]/36)+[.J$18] -> 6.20177069800007 | K47: of:=[.$E$28]*SIN(2*PI()*[.$I47]/36)+[.K$18] -> 2.66119072370363
B48: Distance between point Q and line | D48: d | E48: of:=SQRT(([.E46]-[.E47])^2+([.F46]-[.F47])^2) -> 2.79183388495489 | I48: of:=1+[.I47] -> 2 | J48: of:=[.$E$28]*COS(2*PI()*[.$I48]/36)+[.J$18] -> 5.95863262856425 | K48: of:=[.$E$28]*SIN(2*PI()*[.$I48]/36)+[.K$18] -> 3.56859435209232
B49: Point on line | D49: B | E49: of:=[.E13] -> 6 | F49: of:=[.F13] -> 0 | I49: of:=1+[.I48] -> 3 | J49: of:=[.$E$28]*COS(2*PI()*[.$I49]/36)+[.J$18] -> 5.56161938625338 | K49: of:=[.$E$28]*SIN(2*PI()*[.$I49]/36)+[.K$18] -> 4.41999199776192
B50: Point on line | D50: C | E50: of:=[.E14] -> 2 | F50: of:=[.F14] -> 7 | I50: of:=1+[.I49] -> 4 | J50: of:=[.$E$28]*COS(2*PI()*[.$I50]/36)+[.J$18] -> 5.02279401753668 | K50: of:=[.$E$28]*SIN(2*PI()*[.$I50]/36)+[.K$18] -> 5.18951437407677
B51: Point not on line | D51: O | E51: of:=[.E26] -> 0.894366197183099 | F51: of:=[.F26] -> 1.72535211267606 | I51: of:=1+[.I50] -> 5 | J51: of:=[.$E$28]*COS(2*PI()*[.$I51]/36)+[.J$18] -> 4.35852845858381 | K51: of:=[.$E$28]*SIN(2*PI()*[.$I51]/36)+[.K$18] -> 5.85377993302964
B52: Footer on line F=P1+k0(P2-P1) | C52: (Algorithm found on "Altitudes" worksheet) | D52: F, Q0 | E52: of:=[.E49]+(((([.E51]-[.E49])*([.E50]-[.E49]))+(([.F51]-[.F49])*([.F50]-[.F49])))/(([.E50]-[.E49])^2+([.F50]-[.F49])^2))*([.E50]-[.E49]) -> 4 | F52: of:=[.F49]+(((([.E51]-[.E49])*([.E50]-[.E49]))+(([.F51]-[.F49])*([.F50]-[.F49])))/(([.E50]-[.E49])^2+([.F50]-[.F49])^2))*([.F50]-[.F49]) -> 3.5 | I52: of:=1+[.I51] -> 6 | J52: of:=[.$E$28]*COS(2*PI()*[.$I52]/36)+[.J$18] -> 3.58900608226897 | K52: of:=[.$E$28]*SIN(2*PI()*[.$I52]/36)+[.K$18] -> 6.39260530174634
B53: Distance between point Q and line | D53: d | E53: of:=SQRT(([.E51]-[.E52])^2+([.F51]-[.F52])^2) -> 3.57691717001978 | I53: of:=1+[.I52] -> 7 | J53: of:=[.$E$28]*COS(2*PI()*[.$I53]/36)+[.J$18] -> 2.73760843659936 | K53: of:=[.$E$28]*SIN(2*PI()*[.$I53]/36)+[.K$18] -> 6.78961854405721
B54: Point on line | D54: C | E54: of:=[.E14] -> 2 | F54: of:=[.F14] -> 7 | I54: of:=1+[.I53] -> 8 | J54: of:=[.$E$28]*COS(2*PI()*[.$I54]/36)+[.J$18] -> 1.83020480821067 | K54: of:=[.$E$28]*SIN(2*PI()*[.$I54]/36)+[.K$18] -> 7.03275661349303
B55: Point on line | D55: A | E55: of:=[.E12] -> -3 | F55: of:=[.F12] -> -2 | I55: of:=1+[.I54] -> 9 | J55: of:=[.$E$28]*COS(2*PI()*[.$I55]/36)+[.J$18] -> 0.894366197183099 | K55: of:=[.$E$28]*SIN(2*PI()*[.$I55]/36)+[.K$18] -> 7.11463188284779
B56: Point not on line | D56: O | E56: of:=[.E26] -> 0.894366197183099 | F56: of:=[.F26] -> 1.72535211267606 | I56: of:=1+[.I55] -> 10 | J56: of:=[.$E$28]*COS(2*PI()*[.$I56]/36)+[.J$18] -> -0.0414724138444761 | K56: of:=[.$E$28]*SIN(2*PI()*[.$I56]/36)+[.K$18] -> 7.03275661349303
B57: Footer on line F=P1+k0(P2-P1) | C57: (Algorithm found on "Altitudes" worksheet) | D57: F, Q0 | E57: of:=[.E54]+(((([.E56]-[.E54])*([.E55]-[.E54]))+(([.F56]-[.F54])*([.F55]-[.F54])))/(([.E55]-[.E54])^2+([.F55]-[.F54])^2))*([.E55]-[.E54]) -> -0.5 | F57: of:=[.F54]+(((([.E56]-[.E54])*([.E55]-[.E54]))+(([.F56]-[.F54])*([.F55]-[.F54])))/(([.E55]-[.E54])^2+([.F55]-[.F54])^2))*([.F55]-[.F54]) -> 2.5 | I57: of:=1+[.I56] -> 11 | J57: of:=[.$E$28]*COS(2*PI()*[.$I57]/36)+[.J$18] -> -0.948876042233164 | K57: of:=[.$E$28]*SIN(2*PI()*[.$I57]/36)+[.K$18] -> 6.78961854405721
B58: Distance between point Q and line | D58: d | E58: of:=SQRT(([.E56]-[.E57])^2+([.F56]-[.F57])^2) -> 1.59509762747686 | I58: of:=1+[.I57] -> 12 | J58: of:=[.$E$28]*COS(2*PI()*[.$I58]/36)+[.J$18] -> -1.80027368790277 | K58: of:=[.$E$28]*SIN(2*PI()*[.$I58]/36)+[.K$18] -> 6.39260530174634
I59: of:=1+[.I58] -> 13 | J59: of:=[.$E$28]*COS(2*PI()*[.$I59]/36)+[.J$18] -> -2.56979606421761 | K59: of:=[.$E$28]*SIN(2*PI()*[.$I59]/36)+[.K$18] -> 5.85377993302964
A60: This is transportable code - easy to cut and paste into other worksheets | I60: of:=1+[.I59] -> 14 | J60: of:=[.$E$28]*COS(2*PI()*[.$I60]/36)+[.J$18] -> -3.23406162317048 | K60: of:=[.$E$28]*SIN(2*PI()*[.$I60]/36)+[.K$18] -> 5.18951437407677
A61: Triangle - Vertices | E61: x | F61: y | I61: of:=1+[.I60] -> 15 | J61: of:=[.$E$28]*COS(2*PI()*[.$I61]/36)+[.J$18] -> -3.77288699188718 | K61: of:=[.$E$28]*SIN(2*PI()*[.$I61]/36)+[.K$18] -> 4.41999199776193
B62: Vertex | D62: A | E62: -2 | F62: -2 | I62: of:=1+[.I61] -> 16 | J62: of:=[.$E$28]*COS(2*PI()*[.$I62]/36)+[.J$18] -> -4.16990023419806 | K62: of:=[.$E$28]*SIN(2*PI()*[.$I62]/36)+[.K$18] -> 3.56859435209232
B63: Vertex | D63: B | E63: 5 | F63: 3 | I63: of:=1+[.I62] -> 17 | J63: of:=[.$E$28]*COS(2*PI()*[.$I63]/36)+[.J$18] -> -4.41303830363388 | K63: of:=[.$E$28]*SIN(2*PI()*[.$I63]/36)+[.K$18] -> 2.66119072370363
B64: Vertex | D64: C | E64: 1 | F64: 4 | I64: of:=1+[.I63] -> 18 | J64: of:=[.$E$28]*COS(2*PI()*[.$I64]/36)+[.J$18] -> -4.49491357298864 | K64: of:=[.$E$28]*SIN(2*PI()*[.$I64]/36)+[.K$18] -> 1.72535211267606
A65: Side Lengths, Semiperimeter, Area | E65: d | F65: d2 | I65: of:=1+[.I64] -> 19 | J65: of:=[.$E$28]*COS(2*PI()*[.$I65]/36)+[.J$18] -> -4.41303830363388 | K65: of:=[.$E$28]*SIN(2*PI()*[.$I65]/36)+[.K$18] -> 0.789513501648483
B66: length of side BC | D66: a | E66: of:=SQRT((([.E64]-[.E63])^2)+(([.F64]-[.F63])^2)) -> 4.12310562561766 | F66: of:=(([.E64]-[.E63])^2)+(([.F64]-[.F63])^2) -> 17 | I66: of:=1+[.I65] -> 20 | J66: of:=[.$E$28]*COS(2*PI()*[.$I66]/36)+[.J$18] -> -4.16990023419806 | K66: of:=[.$E$28]*SIN(2*PI()*[.$I66]/36)+[.K$18] -> -0.117890126740207
B67: length of side AC | D67: b | E67: of:=SQRT(([.E62]-[.E64])^2+([.F62]-[.F64])^2) -> 6.70820393249937 | F67: of:=(([.E62]-[.E64])^2+([.F62]-[.F64])^2) -> 45 | I67: of:=1+[.I66] -> 21 | J67: of:=[.$E$28]*COS(2*PI()*[.$I67]/36)+[.J$18] -> -3.77288699188718 | K67: of:=[.$E$28]*SIN(2*PI()*[.$I67]/36)+[.K$18] -> -0.969287772409811
B68: length of side AB | D68: c | E68: of:=SQRT(([.E63]-[.E62])^2+([.F63]-[.F62])^2) -> 8.60232526704263 | F68: of:=(([.E63]-[.E62])^2+([.F63]-[.F62])^2) -> 74 | I68: of:=1+[.I67] -> 22 | J68: of:=[.$E$28]*COS(2*PI()*[.$I68]/36)+[.J$18] -> -3.23406162317048 | K68: of:=[.$E$28]*SIN(2*PI()*[.$I68]/36)+[.K$18] -> -1.73881014872465
B69: semiperimeter | D69: s | E69: of:=([.E66]+[.E67]+[.E68])/2 -> 9.71681741257983 | I69: of:=1+[.I68] -> 23 | J69: of:=[.$E$28]*COS(2*PI()*[.$I69]/36)+[.J$18] -> -2.56979606421761 | K69: of:=[.$E$28]*SIN(2*PI()*[.$I69]/36)+[.K$18] -> -2.40307570767752
B70: Area of triangle | D70: K | E70: of:=SQRT([.E69]*([.E69]-[.E66])*([.E69]-[.E67])*([.E69]-[.E68])) -> 13.5 | I70: of:=1+[.I69] -> 24 | J70: of:=[.$E$28]*COS(2*PI()*[.$I70]/36)+[.J$18] -> -1.80027368790277 | K70: of:=[.$E$28]*SIN(2*PI()*[.$I70]/36)+[.K$18] -> -2.94190107639423
A71: Incenter and Circumcircle | I71: of:=1+[.I70] -> 25 | J71: of:=[.$E$28]*COS(2*PI()*[.$I71]/36)+[.J$18] -> -0.948876042233164 | K71: of:=[.$E$28]*SIN(2*PI()*[.$I71]/36)+[.K$18] -> -3.3389143187051
B72: Incenter | D72: O' | E72: of:=([.E66]*[.E62]+[.E67]*[.E63]+[.E68]*[.E64])/([.E66]+[.E67]+[.E68]) -> 1.74425083023683 | F72: of:=([.E66]*[.F62]+[.E67]*[.F63]+[.E68]*[.F64])/([.E66]+[.E67]+[.E68]) -> 2.3818344859762 | I72: of:=1+[.I71] -> 26 | J72: of:=[.$E$28]*COS(2*PI()*[.$I72]/36)+[.J$18] -> -0.0414724138444762 | K72: of:=[.$E$28]*SIN(2*PI()*[.$I72]/36)+[.K$18] -> -3.58205238814092
B73: radius of incircle | C73: K/s = 2K / (a+b+c)) | D73: r | E73: of:=SQRT((([.E69]-[.E66])*([.E69]-[.E67])*([.E69]-[.E68]))/[.E69]) -> 1.38934379712871 | I73: of:=1+[.I72] -> 27 | J73: of:=[.$E$28]*COS(2*PI()*[.$I73]/36)+[.J$18] -> 0.894366197183098 | K73: of:=[.$E$28]*SIN(2*PI()*[.$I73]/36)+[.K$18] -> -3.66392765749568
B74: Circumcenter | C74: [1] | D74: O | E74: of:=(([.E62]^2+[.F62]^2)*([.F64]-[.F63])+([.E63]^2+[.F63]^2)*([.F62]-[.F64])+([.E64]^2+[.F64]^2)*([.F63]-[.F62]))/(2*([.E62]*([.F64]-[.F63])+[.E63]*([.F62]-[.F64])+[.E64]*([.F63]-[.F62]))) -> 2.05555555555556 | F74: of:=-(([.E62]^2+[.F62]^2)*([.E64]-[.E63])+([.E63]^2+[.F63]^2)*([.E62]-[.E64])+([.E64]^2+[.F64]^2)*([.E63]-[.E62]))/(2*([.E62]*([.F64]-[.F63])+[.E63]*([.F62]-[.F64])+[.E64]*([.F63]-[.F62]))) -> -0.277777777777778 | I74: of:=1+[.I73] -> 28 | J74: of:=[.$E$28]*COS(2*PI()*[.$I74]/36)+[.J$18] -> 1.83020480821067 | K74: of:=[.$E$28]*SIN(2*PI()*[.$I74]/36)+[.K$18] -> -3.58205238814092
B75: radius of circumcircle | C75: a*b*c /(4K) | D75: R | E75: of:=([.E66]*[.E67]*[.E68])/(4*[.E70]) -> 4.40608445753297 | I75: of:=1+[.I74] -> 29 | J75: of:=[.$E$28]*COS(2*PI()*[.$I75]/36)+[.J$18] -> 2.73760843659936 | K75: of:=[.$E$28]*SIN(2*PI()*[.$I75]/36)+[.K$18] -> -3.3389143187051
A76: Interior Angles | E76: deg | F76: rad | I76: of:=1+[.I75] -> 30 | J76: of:=[.$E$28]*COS(2*PI()*[.$I76]/36)+[.J$18] -> 3.58900608226896 | K76: of:=[.$E$28]*SIN(2*PI()*[.$I76]/36)+[.K$18] -> -2.94190107639423
C77: acos((b2+c2-a2)/(2bc)) | D77: a | E77: of:=DEGREES([.F77]) -> 27.8972710309476 | F77: of:=ACOS((([.E67]^2+[.E68]^2)-([.E66]^2))/(2*[.E67]*[.E68])) -> 0.486899231811269 | I77: of:=1+[.I76] -> 31 | J77: of:=[.$E$28]*COS(2*PI()*[.$I77]/36)+[.J$18] -> 4.35852845858381 | K77: of:=[.$E$28]*SIN(2*PI()*[.$I77]/36)+[.K$18] -> -2.40307570767752
C78: acos((c2+a2-b2)/(2bc)) | D78: b | E78: of:=DEGREES([.F78]) -> 49.5739212599009 | F78: of:=ACOS((([.E66]^2+[.E68]^2)-([.E67]^2))/(2*[.E66]*[.E68])) -> 0.865228149109686 | I78: of:=1+[.I77] -> 32 | J78: of:=[.$E$28]*COS(2*PI()*[.$I78]/36)+[.J$18] -> 5.02279401753668 | K78: of:=[.$E$28]*SIN(2*PI()*[.$I78]/36)+[.K$18] -> -1.73881014872466
C79: acos((a2+b2-c2)/(2bc)) | D79: g | E79: of:=DEGREES([.F79]) -> 102.528807709152 | F79: of:=ACOS((([.E66]^2+[.E67]^2)-([.E68]^2))/(2*[.E66]*[.E67])) -> 1.78946527266884 | I79: of:=1+[.I78] -> 33 | J79: of:=[.$E$28]*COS(2*PI()*[.$I79]/36)+[.J$18] -> 5.56161938625338 | K79: of:=[.$E$28]*SIN(2*PI()*[.$I79]/36)+[.K$18] -> -0.969287772409809
E80: of:=SUM([.E77:.E79]) -> 180 | I80: of:=1+[.I79] -> 34 | J80: of:=[.$E$28]*COS(2*PI()*[.$I80]/36)+[.J$18] -> 5.95863262856425 | K80: of:=[.$E$28]*SIN(2*PI()*[.$I80]/36)+[.K$18] -> -0.117890126740207
I81: of:=1+[.I80] -> 35 | J81: of:=[.$E$28]*COS(2*PI()*[.$I81]/36)+[.J$18] -> 6.20177069800007 | K81: of:=[.$E$28]*SIN(2*PI()*[.$I81]/36)+[.K$18] -> 0.789513501648481
I82: of:=1+[.I81] -> 36 | J82: of:=[.$E$28]*COS(2*PI()*[.$I82]/36)+[.J$18] -> 6.28364596735483 | K82: of:=[.$E$28]*SIN(2*PI()*[.$I82]/36)+[.K$18] -> 1.72535211267606
A83: NOTES
A84: 1 | B84: Incenter | C84: O'x = (a*Ax + b*Bx + c*Cz)/(a*b*c)
C85: O'y = (a*Ay + b*By + c*Cy)/(a*b*c)
A86: 2 | B86: Circumcenter | C86: Ox = ((Ax2+Ay2)*(Cy-By) + (Bx2+By2)*(Ay-Cy) + (Cx2+Cy2)*(By-Ay))/(2*(Ax*(Cy-By)+Bx*(Ay-Cy)+ Cx*(By-Ay)))
C87: Oy = -((Ax2+Ay2)*(Cx-Bx) + (Bx2+By2)*(Ax-Cx) + (Cx2+Cy2)*(Bx-Ax))/2*(Ax*(Cy-By)+Bx*(Ay-Cy)+ Cx*(By-Ay))
A88: 3 | B88: Transportable code is HIGHLY CONDENSED, and should not be changed
A90: Sources
B91: Circumcircle | C91: http://en.wikipedia.org/wiki/Circumscribed_circle
B92: Circumcenter | C92: Rourke has a sign error in two terms for Ox